{
  "schemaVersion": 4,
  "submissionId": "20000000-0000-4000-8000-000000000001",
  "attemptId": "10000000-0000-4000-8000-000000000001",
  "leaseToken": "lease_token_opaque_1234",
  "expectedRevision": 4,
  "descriptorBindingHash": "cccccccccccccccccccccccccccccccccccccccccccccccccccccccccccccccc",
  "idempotencyKey": "result-finalize-10000000",
  "attestations": [{"outputName": "primary", "attestationId": "30000000-0000-4000-8000-000000000001"}],
  "resultBinding": {"kind": "OUTPUT_SET", "outputSchemaId": "dda.materialize-query-result.v1", "outputNames": ["primary"]}
}
